id,title,date,journal,pk
NCT01967433,Use of Diphenhydramine as an Adjunctive Sedative for Colonoscopy in Patients Chronically on Opioids,1 January 2020,Journal of emergency nursing,Use of Diphenhydramine as an Adjunctive Sedative for Colonoscopy in Patients Chronically on Opioids_Journal of emergency nursing
NCT04189588,Phase 2 Study IV QUZYTTIR™ (Cetirizine Hydrochloride Injection) vs V Diphenhydramine,1 January 2020,Journal of emergency nursing,Phase 2 Study IV QUZYTTIR™ (Cetirizine Hydrochloride Injection) vs V Diphenhydramine_Journal of emergency nursing
NCT04237091,Feasibility of a Randomized Controlled Clinical Trial Comparing the Use of Cetirizine to Replace Diphenhydramine in the Prevention of Reactions Related to Paclitaxel,1 January 2020,Journal of emergency nursing,Feasibility of a Randomized Controlled Clinical Trial Comparing the Use of Cetirizine to Replace Diphenhydramine in the Prevention of Reactions Related to Paclitaxel_Journal of emergency nursing
NCT04153396,Preemptive Infiltration With Betamethasone and Ropivacaine for Postoperative Pain in Laminoplasty or \xc3\xb1 Laminectomy,1 January 2020,Hôpitaux Universitaires de Genève,Preemptive Infiltration With Betamethasone and Ropivacaine for Postoperative Pain in Laminoplasty or \xc3\xb1 Laminectomy_Hôpitaux Universitaires de Genève
,Glucagon Infusion in T1D Patients With Recurrent Severe Hypoglycemia: Effects on Counter-Regulatory Responses,25/05/2020,Journal of emergency nursing,Glucagon Infusion in T1D Patients With Recurrent Severe Hypoglycemia: Effects on Counter-Regulatory Responses_Journal of emergency nursing
NCT04188184,Tranexamic Acid Versus Epinephrine During Exploratory Tympanotomy,27 April 2020,Journal of emergency nursing\xc3\x28,Tranexamic Acid Versus Epinephrine During Exploratory Tympanotomy_Journal of emergency nursing\xc3\x28
